smartctl 7.2 2020-12-30 r5155 [x86_64-linux-6.5.0-28-generic] (local build)
Copyright (C) 2002-20, Bruce Allen, Christian Franke, www.smartmontools.org

=== START OF INFORMATION SECTION ===
Model Number:                       Phison 1TB SM2801T24GKBB4S-E162
Serial Number:                      511210520037006155
Firmware Version:                   EGFM11.3
PCI Vendor/Subsystem ID:            0x1987
IEEE OUI Identifier:                0x6479a7
Total NVM Capacity:                 1 024 209 543 168 [1,02 TB]
Unallocated NVM Capacity:           0
Controller ID:                      1
NVMe Version:                       1.3
Number of Namespaces:               1
Namespace 1 Size/Capacity:          1 024 209 543 168 [1,02 TB]
Namespace 1 Formatted LBA Size:     512
Namespace 1 IEEE EUI-64:            6479a7 4dc0309f5b
Firmware Updates (0x12):            1 Slot, no Reset required
Optional Admin Commands (0x0017):   Security Format Frmw_DL Self_Test
Optional NVM Commands (0x005d):     Comp DS_Mngmt Wr_Zero Sav/Sel_Feat Timestmp
Log Page Attributes (0x08):         Telmtry_Lg
Maximum Data Transfer Size:         512 Pages
Warning  Comp. Temp. Threshold:     90 Celsius
Critical Comp. Temp. Threshold:     95 Celsius

Supported Power States
St Op     Max   Active     Idle   RL RT WL WT  Ent_Lat  Ex_Lat
 0 +     7.14W       -        -    0  0  0  0        0       0
 1 +     5.43W       -        -    1  1  1  1        0       0
 2 +     4.57W       -        -    2  2  2  2        0       0
 3 -   0.0490W       -        -    3  3  3  3     2000    2000
 4 -   0.0018W       -        -    4  4  4  4    25000   25000

Supported LBA Sizes (NSID 0x1)
Id Fmt  Data  Metadt  Rel_Perf
 0 +     512       0         2
 1 -    4096       0         1

=== START OF SMART DATA SECTION ===
SMART overall-health self-assessment test result: PASSED

SMART/Health Information (NVMe Log 0x02)
Critical Warning:                   0x00
Available Spare:                    100%
Available Spare Threshold:          5%
Percentage Used:                    12%
Unsafe Shutdowns:                   42
Media and Data Integrity Errors:    0
Error Information Log Entries:      585
Warning  Comp. Temperature Time:    0
Critical Comp. Temperature Time:    0

Error Information (NVMe Log 0x01, 16 of 63 entries)
Num   ErrCount  SQId   CmdId  Status  PELoc          LBA  NSID    VS
  0        585     0  0x0014  0x4004  0x028            0     0     -

