smartctl 7.1 2019-12-30 r5022 [x86_64-linux-5.15.0-113-generic] (local build)
Copyright (C) 2002-19, Bruce Allen, Christian Franke, www.smartmontools.org

=== START OF INFORMATION SECTION ===
Model Family:     Hitachi Travelstar 5K500.B
Device Model:     Hitachi HTS545050B9A300
Serial Number:    100803PBN4061701WY9R
LU WWN Device Id: 5 000cca 5f6c0dd46
Firmware Version: PB4OC60F
User Capacity:    500 107 862 016 bytes [500 GB]
Sector Size:      512 bytes logical/physical
Rotation Rate:    5400 rpm
Form Factor:      2.5 inches
Device is:        In smartctl database [for details use: -P show]
ATA Version is:   ATA8-ACS T13/1699-D revision 6
SATA Version is:  SATA 2.6, 3.0 Gb/s
SMART support is: Available - device has SMART capability.
SMART support is: Enabled

=== START OF READ SMART DATA SECTION ===
SMART overall-health self-assessment test result: PASSED

General SMART Values:
Offline data collection status:  (0x00)	Offline data collection activity
					was never started.
					Auto Offline Data Collection: Disabled.
Self-test execution status:      (   0)	The previous self-test routine completed
					without error or no self-test has ever 
					been run.
Total time to complete Offline 
data collection: 		(  645) seconds.
Offline data collection
capabilities: 			 (0x5b) SMART execute Offline immediate.
					Auto Offline data collection on/off support.
					Suspend Offline collection upon new
					command.
					Offline surface scan supported.
					Self-test supported.
					No Conveyance Self-test supported.
					Selective Self-test supported.
SMART capabilities:            (0x0003)	Saves SMART data before entering
					power-saving mode.
					Supports SMART auto save timer.
Error logging capability:        (0x01)	Error logging supported.
					General Purpose Logging supported.
Short self-test routine 
recommended polling time: 	 (   2) minutes.
Extended self-test routine
recommended polling time: 	 ( 158) minutes.
SCT capabilities: 	       (0x003d)	SCT Status supported.
					SCT Error Recovery Control supported.
					SCT Feature Control supported.
					SCT Data Table supported.

SMART Attributes Data Structure revision number: 16
Vendor Specific SMART Attributes with Thresholds:
ID# ATTRIBUTE_NAME          FLAG     VALUE WORST THRESH TYPE      UPDATED  WHEN_FAILED RAW_VALUE
  1 Raw_Read_Error_Rate     0x000b   100   100   062    Pre-fail  Always       -       65536
  2 Throughput_Performance  0x0005   100   100   040    Pre-fail  Offline      -       0
  3 Spin_Up_Time            0x0007   151   151   033    Pre-fail  Always       -       0
  4 Start_Stop_Count        0x0012   095   095   000    Old_age   Always       -       8638
  5 Reallocated_Sector_Ct   0x0033   100   100   005    Pre-fail  Always       -       0
  7 Seek_Error_Rate         0x000b   100   100   067    Pre-fail  Always       -       0
  8 Seek_Time_Performance   0x0005   100   100   040    Pre-fail  Offline      -       0
 10 Spin_Retry_Count        0x0013   100   100   060    Pre-fail  Always       -       0
 12 Power_Cycle_Count       0x0032   095   095   000    Old_age   Always       -       8262
191 G-Sense_Error_Rate      0x000a   100   100   000    Old_age   Always       -       0
192 Power-Off_Retract_Count 0x0032   098   098   000    Old_age   Always       -       408
193 Load_Cycle_Count        0x0012   094   094   000    Old_age   Always       -       66515
196 Reallocated_Event_Count 0x0032   100   100   000    Old_age   Always       -       393
197 Current_Pending_Sector  0x0022   100   100   000    Old_age   Always       -       0
198 Offline_Uncorrectable   0x0008   100   100   000    Old_age   Offline      -       0
199 UDMA_CRC_Error_Count    0x000a   200   200   000    Old_age   Always       -       114
223 Load_Retry_Count        0x000a   100   100   000    Old_age   Always       -       0

SMART Error Log Version: 1
ATA Error Count: 363 (device log contains only the most recent five errors)
	CR = Command Register [HEX]
	FR = Features Register [HEX]
	SC = Sector Count Register [HEX]
	SN = Sector Number Register [HEX]
	CL = Cylinder Low Register [HEX]
	CH = Cylinder High Register [HEX]
	DH = Device/Head Register [HEX]
	DC = Device Command Register [HEX]
	ER = Error register [HEX]
	ST = Status register [HEX]
Powered_Up_Time is measured from power on, and printed as
DDd+hh:mm:SS.sss where DD=days, hh=hours, mm=minutes,
SS=sec, and sss=millisec. It "wraps" after 49.710 days.

Error 363 occurred at disk power-on lifetime: 50965 hours (2123 days + 13 hours)
  When the command that caused the error occurred, the device was active or idle.

  After command completion occurred, registers were:
  ER ST SC SN CL CH DH
  -- -- -- -- -- -- --
  40 51 01 71 d6 8d e1  Error: UNC 1 sectors at LBA = 0x018dd671 = 26072689

  Commands leading to the command that caused the error were:
  CR FR SC SN CL CH DH DC   Powered_Up_Time  Command/Feature_Name
  -- -- -- -- -- -- -- --  ----------------  --------------------
  25 00 01 71 d6 8d e0 00      11:39:40.000  READ DMA EXT
  25 00 01 70 d6 8d e0 00      11:39:40.000  READ DMA EXT
  25 00 01 6f d6 8d e0 00      11:39:40.000  READ DMA EXT
  25 00 01 6e d6 8d e0 00      11:39:40.000  READ DMA EXT
  25 00 01 6d d6 8d e0 00      11:39:40.000  READ DMA EXT

Error 362 occurred at disk power-on lifetime: 50965 hours (2123 days + 13 hours)
  When the command that caused the error occurred, the device was active or idle.

  After command completion occurred, registers were:
  ER ST SC SN CL CH DH
  -- -- -- -- -- -- --
  40 51 3b 71 d6 8d e1  Error: UNC at LBA = 0x018dd671 = 26072689

  Commands leading to the command that caused the error were:
  CR FR SC SN CL CH DH DC   Powered_Up_Time  Command/Feature_Name
  -- -- -- -- -- -- -- --  ----------------  --------------------
  42 00 00 ac d3 8d e0 00      11:39:35.700  READ VERIFY SECTOR(S) EXT
  42 00 00 ac cb 8d e0 00      11:39:35.600  READ VERIFY SECTOR(S) EXT
  42 00 00 ac c3 8d e0 00      11:39:35.600  READ VERIFY SECTOR(S) EXT
  42 00 00 ac bb 8d e0 00      11:39:35.600  READ VERIFY SECTOR(S) EXT
  42 00 00 ac b3 8d e0 00      11:39:35.600  READ VERIFY SECTOR(S) EXT

Error 361 occurred at disk power-on lifetime: 50965 hours (2123 days + 13 hours)
  When the command that caused the error occurred, the device was active or idle.

  After command completion occurred, registers were:
  ER ST SC SN CL CH DH
  -- -- -- -- -- -- --
  40 51 01 ab 5b 84 e1  Error: UNC 1 sectors at LBA = 0x01845bab = 25451435

  Commands leading to the command that caused the error were:
  CR FR SC SN CL CH DH DC   Powered_Up_Time  Command/Feature_Name
  -- -- -- -- -- -- -- --  ----------------  --------------------
  25 00 01 ab 5b 84 e0 00      11:39:23.600  READ DMA EXT
  25 00 01 aa 5b 84 e0 00      11:39:23.600  READ DMA EXT
  25 00 01 a9 5b 84 e0 00      11:39:23.600  READ DMA EXT
  25 00 01 a8 5b 84 e0 00      11:39:23.600  READ DMA EXT
  25 00 01 a7 5b 84 e0 00      11:39:23.600  READ DMA EXT

Error 360 occurred at disk power-on lifetime: 50965 hours (2123 days + 13 hours)
  When the command that caused the error occurred, the device was active or idle.

  After command completion occurred, registers were:
  ER ST SC SN CL CH DH
  -- -- -- -- -- -- --
  40 51 6d ab 5b 84 e1  Error: UNC at LBA = 0x01845bab = 25451435

  Commands leading to the command that caused the error were:
  CR FR SC SN CL CH DH DC   Powered_Up_Time  Command/Feature_Name
  -- -- -- -- -- -- -- --  ----------------  --------------------
  42 00 00 18 5a 84 e0 00      11:39:19.500  READ VERIFY SECTOR(S) EXT
  42 00 00 18 52 84 e0 00      11:39:19.500  READ VERIFY SECTOR(S) EXT
  42 00 00 18 4a 84 e0 00      11:39:19.400  READ VERIFY SECTOR(S) EXT
  42 00 00 18 42 84 e0 00      11:39:19.400  READ VERIFY SECTOR(S) EXT
  42 00 00 18 3a 84 e0 00      11:39:19.400  READ VERIFY SECTOR(S) EXT

Error 359 occurred at disk power-on lifetime: 50965 hours (2123 days + 13 hours)
  When the command that caused the error occurred, the device was active or idle.

  After command completion occurred, registers were:
  ER ST SC SN CL CH DH
  -- -- -- -- -- -- --
  40 51 3b dd 1e 97 e1  Error: UNC at LBA = 0x01971edd = 26681053

  Commands leading to the command that caused the error were:
  CR FR SC SN CL CH DH DC   Powered_Up_Time  Command/Feature_Name
  -- -- -- -- -- -- -- --  ----------------  --------------------
  42 00 00 18 1a 97 e0 00      11:35:41.200  READ VERIFY SECTOR(S) EXT
  42 00 00 18 12 97 e0 00      11:35:36.700  READ VERIFY SECTOR(S) EXT
  42 00 00 18 0a 97 e0 00      11:35:36.700  READ VERIFY SECTOR(S) EXT
  42 00 00 18 02 97 e0 00      11:35:36.700  READ VERIFY SECTOR(S) EXT
  42 00 00 18 fa 96 e0 00      11:35:36.600  READ VERIFY SECTOR(S) EXT

SMART Self-test log structure revision number 1
Num  Test_Description    Status                  Remaining  LifeTime(hours)  LBA_of_first_error
# 1  Short offline       Completed: read failure       50%     24983         562875173
# 2  Short offline       Completed: read failure       90%     20755         562943601
# 3  Short offline       Completed without error       00%     16011         -

SMART Selective self-test log data structure revision number 1
 SPAN  MIN_LBA  MAX_LBA  CURRENT_TEST_STATUS
    1        0        0  Not_testing
    2        0        0  Not_testing
    3        0        0  Not_testing
    4        0        0  Not_testing
    5        0        0  Not_testing
Selective self-test flags (0x0):
  After scanning selected spans, do NOT read-scan remainder of disk.
If Selective self-test is pending on power-up, resume after 0 minute delay.

